{
  "$schema": "https://json-schema.org/draft/2020-12/schema",
  "$id": "https://github.com/ngmeyer/skills/blob/main/skills/engineering/ux-review/references/findings-schema.json",
  "title": "UI findings artifact (ux-review and anti-ai-slop-ui)",
  "description": "One run of one skill on one target. Concatenate the findings arrays of both skills to rank them together.",
  "type": "object",
  "additionalProperties": false,
  "required": ["schema_version", "skill", "run_id", "previous_run_id", "target", "config", "tools", "scores", "findings", "summary", "loop"],
  "properties": {
    "schema_version": {"const": "1.0"},
    "skill": {"enum": ["ux-review", "anti-ai-slop-ui"]},
    "run_id": {"type": "string", "pattern": "^\\d{4}-\\d{2}-\\d{2}T\\d{2}:\\d{2}:\\d{2}([+-]\\d{2}:\\d{2}|Z)_[0-9a-f]{4}$"},
    "previous_run_id": {"type": ["string", "null"]},
    "target": {
      "type": "object",
      "required": ["type", "url", "platforms", "viewports", "commit", "screens"],
      "properties": {
        "type": {"enum": ["site", "page", "mobile-web", "native-app", "flutter-app", "screenshots"]},
        "url": {"type": ["string", "null"]},
        "commit": {"type": ["string", "null"]},
        "platforms": {"type": "array", "items": {"enum": ["web-mobile", "web-tablet", "web-desktop", "ios", "android", "flutter"]}},
        "viewports": {"type": "array", "items": {"type": "string", "pattern": "^\\d+x\\d+$"}},
        "capture": {
          "type": "object",
          "description": "Settings that must match the previous run for a fair diff.",
          "properties": {"color_scheme": {"enum": ["light", "dark"]}, "reduced_motion": {"type": "boolean"}, "device_profiles": {"type": "array", "items": {"type": "string"}}}
        },
        "screens": {
          "type": "array",
          "minItems": 1,
          "items": {
            "type": "object",
            "required": ["screen", "primary_task"],
            "properties": {
              "screen": {"type": "string", "description": "Route for web, screen name for apps."},
              "primary_task": {"type": "string"},
              "primary_task_source": {"enum": ["caller", "inferred"]},
              "scores": {"$ref": "#/$defs/itemScores"}
            }
          }
        }
      }
    },
    "config": {
      "type": "object",
      "required": ["section_weights", "target_pct"],
      "properties": {
        "section_weights": {
          "type": "object",
          "required": ["laws", "heuristics", "wcag", "platform"],
          "properties": {
            "laws": {"type": "number", "minimum": 0},
            "heuristics": {"type": "number", "minimum": 0},
            "wcag": {"type": "number", "minimum": 0},
            "platform": {"type": "number", "minimum": 0}
          }
        },
        "target_pct": {"type": "number", "minimum": 0, "maximum": 100},
        "slop_target": {"type": "number", "minimum": 0, "maximum": 100},
        "iteration_budget": {"type": "integer", "minimum": 1}
      }
    },
    "tools": {"type": "object", "additionalProperties": {"type": ["string", "null"]}},
    "scores": {
      "type": "object",
      "required": ["laws", "heuristics", "wcag", "platform", "na_reasons", "sections_pct", "overall_pct", "grade", "grade_cap_reason", "slop_score"],
      "properties": {
        "laws": {"oneOf": [{"type": "null"}, {"$ref": "#/$defs/scoreMap"}]},
        "heuristics": {"oneOf": [{"type": "null"}, {"$ref": "#/$defs/scoreMap"}]},
        "wcag": {"oneOf": [{"type": "null"}, {"$ref": "#/$defs/scoreMap"}]},
        "platform": {"oneOf": [{"type": "null"}, {"$ref": "#/$defs/scoreMap"}]},
        "na_reasons": {"type": "object", "additionalProperties": {"type": "string", "minLength": 3}},
        "sections_pct": {"type": ["object", "null"], "additionalProperties": {"type": ["number", "null"], "minimum": 0, "maximum": 100}},
        "overall_pct": {"type": ["number", "null"], "minimum": 0, "maximum": 100},
        "grade": {"enum": ["A", "B", "C", "D", "F", null]},
        "grade_cap_reason": {"type": ["string", "null"]},
        "slop_score": {"type": ["number", "null"], "minimum": 0, "maximum": 100},
        "slop_band": {"enum": ["none", "isolated", "pattern", "template-grade", null]}
      }
    },
    "findings": {"type": "array", "items": {"$ref": "#/$defs/finding"}},
    "summary": {"type": "object", "required": ["p0", "p1", "p2", "p3", "new", "persisting", "resolved", "regressed"], "additionalProperties": {"type": "integer", "minimum": 0}},
    "loop": {
      "type": ["object", "null"],
      "required": ["iteration", "decision", "reason"],
      "properties": {
        "iteration": {"type": "integer", "minimum": 1},
        "decision": {"enum": ["continue", "block-regression", "stop-target-met", "stop-plateau", "stop-budget", "escalate-stuck", "baseline-reset"]},
        "reason": {"type": "string"}
      }
    }
  },
  "allOf": [
    {
      "if": {"properties": {"skill": {"const": "anti-ai-slop-ui"}}},
      "then": {
        "properties": {
          "scores": {
            "properties": {"laws": {"type": "null"}, "heuristics": {"type": "null"}, "wcag": {"type": "null"}, "platform": {"type": "null"}, "slop_score": {"type": "number"}}
          }
        }
      },
      "else": {"properties": {"scores": {"properties": {"slop_score": {"type": "null"}}}}}
    }
  ],
  "$defs": {
    "score": {"oneOf": [{"type": "number", "minimum": 0, "maximum": 4}, {"const": "n/a"}]},
    "scoreMap": {"type": "object", "additionalProperties": {"$ref": "#/$defs/score"}},
    "itemScores": {
      "type": "object",
      "properties": {
        "laws": {"$ref": "#/$defs/scoreMap"},
        "heuristics": {"$ref": "#/$defs/scoreMap"},
        "wcag": {"$ref": "#/$defs/scoreMap"},
        "platform": {"$ref": "#/$defs/scoreMap"}
      }
    },
    "finding": {
      "type": "object",
      "additionalProperties": false,
      "required": ["id", "rule", "also", "category", "location", "evidence", "severity", "reach", "reach_source", "effort", "confidence", "priority_score", "tier", "fix", "refs", "delegate_to", "status", "diff"],
      "properties": {
        "id": {"type": "string", "pattern": "^(uxr|slop)_[0-9a-f]{10}$"},
        "rule": {"type": "string", "description": "Law id, H1-H10, WCAG SC number, platform item id, or tell id T01-T23."},
        "also": {"type": "array", "items": {"type": "string"}, "uniqueItems": true},
        "category": {"type": "string"},
        "location": {
          "type": "object",
          "required": ["screen", "viewport"],
          "properties": {
            "screen": {"type": "string", "description": "Normalized: URL path only, lowercased, no trailing slash, id segments as :id; or the manifest screen name."},
            "viewport": {"type": "string", "pattern": "^\\d+x\\d+$"},
            "element_key": {"type": "string", "pattern": "^(region:r[1-4]c[1-4]|[a-z][a-z0-9-]*(\\|\\S.{0,59})?)$", "description": "Hashed into the id: <role>|<name>, NFKC, lowercased, whitespace collapsed, digit runs as #, first 60 chars; <role> alone if unnamed; region:rNcM if screenshot-only and no role is evident."},
            "selector": {"type": ["string", "null"], "description": "Raw selector for locating the element. Never hashed."},
            "region": {"type": ["string", "null"], "description": "Coarse grid cell for screenshot-only runs, e.g. r3c2 on a 4x4 grid."},
            "screenshot": {"type": ["string", "null"]},
            "bbox": {"type": ["array", "null"], "items": {"type": "number"}, "minItems": 4, "maxItems": 4}
          }
        },
        "evidence": {"type": "string", "minLength": 10},
        "severity": {"type": "integer", "minimum": 0, "maximum": 4},
        "reach": {"type": "integer", "minimum": 1, "maximum": 5},
        "reach_source": {"enum": ["funnel_weight", "sessions", "caller"]},
        "effort": {"type": "integer", "minimum": 1, "maximum": 5},
        "confidence": {"enum": [1.0, 0.8, 0.5]},
        "priority_score": {"type": "number", "minimum": 0},
        "tier": {"enum": ["P0", "P1", "P2", "P3"]},
        "tier_reason": {"type": ["string", "null"]},
        "fix": {"type": "string", "minLength": 10},
        "refs": {"type": "array", "items": {"type": "string", "format": "uri"}},
        "delegate_to": {"type": ["string", "null"]},
        "status": {"enum": ["open", "investigating", "pr_open", "shipped", "verified", "wontfix"]},
        "diff": {"enum": ["new", "persisting", "resolved", "regressed"]},
        "fix_attempts": {"type": "integer", "minimum": 0, "description": "Fix PRs shipped against this id; 2 with the finding still live means stuck."},
        "tell_weight": {"type": ["number", "null"], "minimum": 0},
        "craft_credit": {"type": ["string", "null"]}
      }
    }
  }
}
