{
  "schema_version": "1.0",
  "skill": "ux-review",
  "run_id": "2026-10-29T14:05:00-07:00_ab12",
  "previous_run_id": "2026-10-28T14:02:11-07:00_9f3c",
  "target": {
    "type": "page",
    "url": "https://preview.example.com/signup",
    "commit": "a1b2c3d",
    "platforms": ["web-mobile", "web-desktop"],
    "viewports": ["375x812", "1280x800"],
    "capture": {
      "color_scheme": "light",
      "reduced_motion": true,
      "device_profiles": ["iPhone 13"]
    },
    "screens": [
      {"screen": "/signup", "primary_task": "create an account", "primary_task_source": "caller"}
    ]
  },
  "config": {
    "section_weights": {"laws": 35, "heuristics": 25, "wcag": 25, "platform": 15},
    "target_pct": 85,
    "iteration_budget": 5
  },
  "tools": {"axe": "4.10", "lighthouse": "12.2", "playwright": "1.48", "flutter_guidelines": null},
  "scores": {
    "laws": {"aesthetic-usability-effect": 4, "choice-overload": 2, "chunking": 4, "cognitive-bias": 4, "cognitive-load": 4, "doherty-threshold": 4, "fittss-law": 1, "flow": 4, "goal-gradient-effect": "n/a", "hicks-law": 2, "jakobs-law": 4, "law-of-common-region": 4, "law-of-proximity": 4, "law-of-pragnanz": 4, "law-of-similarity": 4, "law-of-uniform-connectedness": 4, "mental-model": 4, "millers-law": 4, "occams-razor": 3, "paradox-of-the-active-user": 4, "pareto-principle": 4, "parkinsons-law": 4, "peak-end-rule": 1, "postels-law": 4, "selective-attention": 4, "serial-position-effect": 4, "teslers-law": 4, "von-restorff-effect": 2, "working-memory": 4, "zeigarnik-effect": "n/a"},
    "heuristics": {"H1": 4, "H2": 4, "H3": 4, "H4": 4, "H5": 4, "H6": 2, "H7": "n/a", "H8": 4, "H9": 1, "H10": 4},
    "wcag": {"1.1.1": 4, "1.3.1": 2, "1.4.3": 2, "1.4.10": 4, "1.4.11": 4, "2.1.1": 4, "2.4.7": 4, "2.4.11": 4, "2.5.8": 4, "3.3.1": 1, "4.1.2": 4},
    "platform": {"touch-target-44": 1, "thumb-zone": 4, "ios-hit-44pt": "n/a", "android-target-48dp": "n/a", "safe-area": "n/a", "flutter-tap-target": "n/a", "flutter-labeled-tap": "n/a", "flutter-text-contrast": "n/a"},
    "na_reasons": {"goal-gradient-effect": "single-step form; no progress to show", "zeigarnik-effect": "no incomplete state exists before an account", "ios-hit-44pt": "platform not in target", "android-target-48dp": "platform not in target", "safe-area": "platform not in target", "flutter-tap-target": "platform not in target", "flutter-labeled-tap": "platform not in target", "flutter-text-contrast": "platform not in target", "H7": "first-run screen; no frequent-user path to accelerate"},
    "sections_pct": {"laws": 88.4, "heuristics": 86.1, "wcag": 84.1, "platform": 62.5},
    "overall_pct": 82.9,
    "grade": "C",
    "grade_cap_reason": "live WCAG 2.2 AA failure",
    "slop_score": null
  },
  "findings": [
    {
      "id": "uxr_fecfeacb78", "rule": "fittss-law", "also": ["touch-target-44"], "category": "interaction",
      "location": {"screen": "/signup", "viewport": "375x812", "element_key": "button|create account", "selector": "form button[type=submit]", "region": null, "screenshot": "shots/signup-375.png", "bbox": [16, 702, 120, 32]},
      "evidence": "Submit button is 120x32 CSS px, 4 px from a 32 px 'Back' link, and sits at the right edge, outside the thumb arc.",
      "severity": 3, "reach": 5, "reach_source": "funnel_weight", "effort": 1, "confidence": 1.0, "priority_score": 45.0, "tier": "P1", "tier_reason": null,
      "fix": "Make submit a full-width 48 px primary button; move 'Back' above the form as a text link (fittss-law, von-restorff-effect).",
      "refs": ["https://lawsofux.com/fittss-law/"], "delegate_to": null, "status": "open", "diff": "persisting"
    },
    {
      "id": "uxr_33f6669b5a", "rule": "1.4.3", "also": ["1.3.1", "H6"], "category": "accessibility",
      "location": {"screen": "/signup", "viewport": "375x812", "element_key": "textbox|email", "selector": "form input[type=email]", "region": null, "screenshot": "shots/signup-375.png", "bbox": [16, 420, 343, 44]},
      "evidence": "axe color-contrast: placeholder used as the only label, #9CA3AF on #FFFFFF, ratio 2.54:1.",
      "severity": 2, "reach": 5, "reach_source": "funnel_weight", "effort": 1, "confidence": 1.0, "priority_score": 20.0, "tier": "P1", "tier_reason": "WCAG 2.2 AA failure",
      "fix": "Add a visible <label> above each field and darken hint text to at least 4.5:1.",
      "refs": ["https://www.w3.org/WAI/WCAG22/Understanding/contrast-minimum.html"], "delegate_to": null, "status": "open", "diff": "new"
    },
    {
      "id": "uxr_5b35891026", "rule": "H9", "also": ["peak-end-rule", "3.3.1"], "category": "feedback",
      "location": {"screen": "/signup", "viewport": "375x812", "element_key": "alert|something went wrong", "selector": "[role=alert]", "region": null, "screenshot": "shots/signup-375-error.png", "bbox": [16, 380, 343, 40]},
      "evidence": "Invalid email shows a toast 'Something went wrong' at the top and clears the form.",
      "severity": 3, "reach": 5, "reach_source": "funnel_weight", "effort": 2, "confidence": 0.8, "priority_score": 18.0, "tier": "P1", "tier_reason": null,
      "fix": "Show the error inline under the email field, keep what was typed, focus the field. Wording goes to the copy skill.",
      "refs": ["https://www.nngroup.com/articles/ten-usability-heuristics/"], "delegate_to": "write-well", "status": "open", "diff": "persisting"
    },
    {
      "id": "uxr_0f3b1d1890", "rule": "hicks-law", "also": ["choice-overload", "von-restorff-effect"], "category": "layout",
      "location": {"screen": "/signup", "viewport": "1280x800", "element_key": "group|sign-up options", "selector": "main .auth-options", "region": null, "screenshot": "shots/signup-1280.png", "bbox": [480, 240, 320, 200]},
      "evidence": "Four equal-weight buttons (two providers, email, 'Book a demo') before the form; none is marked as recommended.",
      "severity": 2, "reach": 5, "reach_source": "funnel_weight", "effort": 2, "confidence": 0.8, "priority_score": 8.0, "tier": "P2", "tier_reason": null,
      "fix": "Lead with the email form as the one primary action; collapse providers into a single 'Other ways to sign up' row; move 'Book a demo' to the footer.",
      "refs": ["https://lawsofux.com/hicks-law/"], "delegate_to": null, "status": "open", "diff": "new"
    },
    {
      "id": "uxr_845e3c4a09", "rule": "occams-razor", "also": [], "category": "layout",
      "location": {"screen": "/signup", "viewport": "375x812", "element_key": "figure", "selector": "main figure.hero-illustration", "region": null, "screenshot": "shots/signup-375.png", "bbox": [0, 64, 375, 260]},
      "evidence": "Decorative illustration pushes the first field below the fold at 375 px.",
      "severity": 1, "reach": 5, "reach_source": "funnel_weight", "effort": 1, "confidence": 0.5, "priority_score": 2.5, "tier": "P3", "tier_reason": null,
      "fix": "Hide the illustration below 768 px so the first field is visible on load.",
      "refs": ["https://lawsofux.com/occams-razor/"], "delegate_to": null, "status": "open", "diff": "new"
    },
    {
      "id": "uxr_d927b6c503", "rule": "2.4.11", "also": ["H1"], "category": "accessibility",
      "location": {"screen": "/signup", "viewport": "375x812", "element_key": "dialog|cookie consent", "selector": "body .cookie-banner", "region": null, "screenshot": "shots/signup-375.png", "bbox": [0, 700, 375, 112]},
      "evidence": "Last run: cookie banner covered the focused submit button. Not reproduced this run.",
      "severity": 3, "reach": 5, "reach_source": "funnel_weight", "effort": 2, "confidence": 1.0, "priority_score": 22.5, "tier": "P1", "tier_reason": "WCAG 2.2 AA failure",
      "fix": "Offset sticky UI with scroll-padding-bottom equal to the banner height.",
      "refs": ["https://www.w3.org/WAI/WCAG22/Understanding/focus-not-obscured-minimum.html"], "delegate_to": null, "status": "verified", "diff": "resolved"
    }
  ],
  "summary": {"p0": 0, "p1": 3, "p2": 1, "p3": 1, "new": 3, "persisting": 2, "resolved": 1, "regressed": 0},
  "loop": {"iteration": 3, "decision": "continue", "reason": "3 live P1 remain; 1 resolved since last run"}
}
